name,position,date,status,comment
Robert Williams III,C,Feb 8,Out,
Al Horford,C,Feb 8,Out,"Horford (knee) won't play in Wednesday's game versus the 76ers, Keith Smith of Spotrac.com reports."
Marcus Smart,PG,Jan 31,Out,"Smart (ankle) said Tuesday that he's without a clear timeline to return to game action and acknowledged the possibility that he could remain out through the All-Star break, Jay King of The Athletic reports."
Danilo Gallinari,PF,Jan 25,Out,Gallinari (knee) said Sunday in an interview with Gianluca Bortolomai of AroundTheGame.com that his goal remains to return to game action at some point during the Celtics' postseason run.
Day'Ron Sharpe,C,Feb 8,Day-To-Day,
Seth Curry,SG,Feb 8,Out,
Yuta Watanabe,SF,Feb 8,Day-To-Day,"Watanabe (back) is questionable for Thursday's game against the Bulls, Christian Arnold of Associated Press reports."
Kevin Durant,PF,Feb 7,Out,"Coach Jacque Vaughn intimated that Durant's (knee) medical update was ""really good,"" but the star has yet to do contact work and remains without a timetable for a return, Chris Milholen of NetsDaily.com reports."
Cody Martin,SF,Feb 7,Out,Martin (knee) won't play in Wednesday's game versus the Wizards.
Kelly Oubre Jr.,SG,Feb 3,Out,"Oubre suggested Thursday that he expects to transition into a smaller brace to protect his surgically repaired left hand, Roderick Boone of The Charlotte Observer reports. He anticipates wearing the brace for 1-to-2 weeks. ""And then right after [the 1-to-2-week period] we'll be at All-Star break,"" Oubre said. ""And then that's, Godspeed, the plan to come back."""
Patrick Williams,PF,Feb 8,Day-To-Day,
DeMar DeRozan,SF,Feb 8,Day-To-Day,DeRozan (hip) is questionable for Thursday's game against Brooklyn.
Alex Caruso,SG,Feb 8,Day-To-Day,Caruso is probable for Thursday's game versus the Nets due to left midfoot soreness.
Javonte Green,SF,Feb 6,Out,"Head coach Billy Donovan said Monday that Green (knee) still isn't running, and it's unclear when he'll be able to suit up again, Julia Poe of the Chicago Tribune reports."
Lonzo Ball,PG,Jan 28,Out,"Coach Billy Donovan said before Saturday's game against the Magic that Ball (knee) is ""nowhere close"" to returning and the team will have a formal conversation about a cut-off date if nothing improves by the All-Star break, Julia Poe of the Chicago Tribune reports."
Donovan Mitchell,SG,Feb 8,Out,"Mitchell (groin) will sit out Wednesday's game versus the Pistons, Chris Fedor of The Cleveland Plain Dealer reports."
Darius Garland,PG,Feb 8,Out,
Dylan Windler,SG,Jan 24,Out,"Head coach J.B. Bickerstaff said Monday that Windler (ankle) is making progress and expected to play at some point this season, but the forward remains out indefinitely, Evan Dammarell of FearTheSword.com reports."
Frank Ntilikina,PG,Feb 7,Day-To-Day,
Luka Doncic,PG,Feb 6,Out,"Doncic (heel) is set to rejoin the team Wednesday in Los Angeles but won't play against the Clippers, Callie Caplan of The Dallas Morning News reports."
Davis Bertans,SF,Feb 4,Out,"Bertans (calf) is expected to miss at least two weeks, Callie Caplan of The Dallas Morning News reports."
Maxi Kleber,PF,Feb 2,Out,"Kleber (hamstring) will remain out for the Mavericks' upcoming five-game road trip but has been cleared for contact work, Callie Caplan of The Dallas Morning News reports."
Jamal Murray,PG,Feb 8,Day-To-Day,Murray (knee) is questionable for Thursday's game versus the Magic.
Zeke Nnaji,PF,Feb 8,Day-To-Day,Nnaji (shoulder) is doubtful for Thursday's game against the Magic.
Collin Gillespie,G,Feb 6,Out,Gillespie (lower leg) has been ruled out for Tuesday's matchup against Minnesota.
Marvin Bagley III,PF,Jan 5,Out,"Bagley underwent surgery to repair a fracture of the third and fourth metacarpals in his right hand Thursday and will be re-evaluated in six weeks, NBA writer Marc Stein reports."
Cade Cunningham,PG,Dec 16,Out,"Cunningham (lower leg) underwent successful surgery Friday to stabilize and promote healing of his left tibial stress fracture, James L. Edwards III of The Athletic reports."
Andre Iguodala,F,Feb 7,Out,Iguodala (hip) won't play in Wednesday's game versus the Trail Blazers.
Ryan Rollins,G,Feb 6,Out,
Stephen Curry,PG,Feb 5,Out,"An MRI taken on Curry's injured left knee revealed partial tears of his superior tibiofibular ligaments and interosseous membrane, as well as a lower left leg contusion, C.J. Holmes of the San Francisco Chronicle reports."
Garrison Mathews,SG,Feb 8,Out,
Kevin Porter Jr.,SG,Feb 6,Out,"Porter (foot) will remain out for Monday's game against the Kings, Jonathan Feigen of the Houston Chronicle reports."
Moussa Diabate,F,Feb 7,Out,
John Wall,PG,Jan 31,Out,"Head coach Ty Lue relayed Tuesday that Wall (abdomen) remains without a specific target date to retake the floor, Andrew Greif of the Los Angeles Times reports."
Scotty Pippen Jr.,G,Feb 4,Out,
Steven Adams,C,Jan 24,Out,Adams has been diagnosed with a PCL sprain in his right knee and is expected to miss the next 3-to-5 weeks.
Victor Oladipo,SG,Feb 7,Out,"Oladipo (ankle) is out for Wednesday's game versus the Pacers, Ira Winderman of the South Florida Sun Sentinel reports."
Duncan Robinson,F,Feb 7,Out,"Robinson (finger) has been ruled out for Wednesday's game against the Pacers, Anthony Chiang of the Miami Herald reports."
Kyle Lowry,PG,Feb 7,Out,"Lowry (knee) will be out for the next three games, Ira Winderman of the South Florida Sun Sentinel reports. His next chance to play arrives Monday against the Nuggets."
Omer Yurtseven,C,Jan 30,Out,"Yurtseven's left ankle has fully healed from surgery, and he's been cleared for high-impact work, Barry Jackson of the Miami Herald reports."
Nikola Jovic,F,Jan 3,Out,"Jovic (back) will miss another four weeks, Ira Winderman of the South Florida Sun Sentinel reports."
Joe Ingles,SG,Feb 8,Out,Ingles (rest) will not suit up for Thursday's game against the Lakers.
Brook Lopez,C,Feb 8,Day-To-Day,
Giannis Antetokounmpo,PF,Feb 8,Day-To-Day,Antetokounmpo is probable for Thursday's game versus the Lakers due to right knee soreness.
Bobby Portis,F,Jan 25,Out,"Portis (knee) is expected to miss at least two weeks, Adrian Wojnarowski of ESPN reports."
Serge Ibaka,F,Jan 20,Out,"Ibaka (personal) and the Bucks mutually agreed Friday to begin pursuing trade opportunities, Shams Charania of The Athletic reports."
Jordan McLaughlin,PG,Feb 8,Day-To-Day,McLaughlin is questionable for Wednesday's game against the Jazz due to left calf strain injury management.
Rudy Gobert,C,Feb 8,Day-To-Day,
Kyle Anderson,SF,Feb 8,Day-To-Day,Anderson (back) is questionable for Wednesday's game versus the Jazz.
Austin Rivers,SG,Feb 4,Out,"Rivers has received a three-game suspension for his actions in the scuffle during Friday's game against the Magic, Jason Anderson of The Sacramento Bee reports."
Karl-Anthony Towns,C,Jan 31,Out,"Timberwolves general manager Tim Connelly relayed Tuesday that Towns (calf) remains sidelined indefinitely, Dane Moore of 'The Dane Moore NBA Podcast' reports."
Zion Williamson,PF,Feb 8,Out,"Williamson (hamstring) will be re-evaluated after the All-Star break, Andrew Lopez of ESPN.com reports."
Dyson Daniels,G,Feb 6,Out,Daniels (ankle) has been ruled out for Tuesday's matchup against the Hawks.
E.J. Liddell,F,Oct 16,Out,Liddell (knee) signed a two-way contract with the Pelicans on Sunday.
Mitchell Robinson,C,Jan 29,Out,"Knicks team owner James Dolan said Thursday in his appearance on the ""Good Day New York"" program that Robinson (thumb) will be sidelined for four more weeks, Steve Popper of Newsday reports."
Luguentz Dort,G,Feb 7,Out,"Dort (hamstring) won't play in Tuesday's game against the Lakers, Joe Mussatto of The Oklahoman reports."
Jeremiah Robinson-Earl,PF,Feb 5,Out,Robinson-Earl (ankle) remains on assignment with the G League's Oklahoma City Blue and won't play in Monday's matchup against the Warriors.
Aleksej Pokusevski,F,Dec 28,Out,"Pokusevski sustained a non-displaced tibial plateau fracture in his left leg Tuesday's game against the Thunder and will be re-evaluated in six to eight weeks, Nick Crain of Forbes.com reports."
Chet Holmgren,PF,Dec 6,Out,"Holmgren (foot) underwent a successful secondary procedure Tuesday to remove hardware from his initial Lisfranc surgery in August, Michael Scotto of USA Today reports."
Gary Harris,SG,Feb 8,Day-To-Day,
Mo Bamba,C,Feb 4,Out,
Devin Booker,SG,Feb 8,Out,
Cameron Payne,PG,Feb 3,Out,"The Suns announced Friday that Payne (foot) will be re-evaluated in a week, Duane Rankin of The Arizona Republic reports."
Landry Shamet,SG,Jan 30,Out,"Shamet (foot) won't play Monday against the Raptors and is out indefinitely, Duane Rankin of The Arizona Republic reports."
Jae Crowder,PF,Jan 15,Out,"Crowder, who has been away from the Suns all season while the team explores avenues to trade him, has been working out daily in Atlanta in order to stay ready for his next opportunity to play, Chris Haynes of BleacherReport.com reports."
Ibou Badji,C,Feb 7,Out,Badji (knee) is out for Wednesday's matchup with Golden State.
Keon Johnson,SG,Feb 7,Day-To-Day,Johnson (ankle) is questionable for Wednesday's game versus the Warriors.
Justise Winslow,PF,Feb 7,Out,Winslow (ankle) remains out Wednesday against the Warriors.
Drew Eubanks,PF,Feb 7,Day-To-Day,
Jusuf Nurkic,C,Feb 3,Out,Nurkic is in line to be sidelined through the All-Star break after an MRI on Thursday revealed a left calf strain.
Tre Jones,PG,Feb 8,Out,"Jones (foot) has been ruled out for Wednesday's game against the Raptors, Ty Jager of PoundingTheRock.com reports."
Jeremy Sochan,F,Feb 8,Out,"Sochan (back) has been ruled out for Wednesday's game against Toronto, Ty Jager of PoundingTheRock.com reports."
Dewayne Dedmon,C,Feb 7,Out,Dedmon is listed as out Wednesday against the Raptors.
Romeo Langford,SG,Feb 7,Out,"Langford (thigh) is out for Wednesday's matchup at Toronto, Jeff Garcia of KENS 5 San Antonio reports."
Charles Bassey,C,Feb 4,Day-To-Day,
Devin Vassell,SG,Jan 17,Out,"Vassell (knee) was spotted Tuesday doing some walking on a treadmill, Tom Osborn of the San Antonio Express-News reports."
O.G. Anunoby,SF,Feb 7,Out,"Anunoby (wrist) has been ruled out for Wednesday's game against the Spurs, Eric Koreen of The Athletic reports."
Otto Porter Jr.,SF,Jan 10,Out,"The Raptors announced Tuesday that Porter underwent season-ending surgery on his left foot, Marc J. Spears of ESPN.com reports."
Jarred Vanderbilt,PF,Feb 8,Day-To-Day,"Vanderbilt (back) participated in Wednesday's shootaround, Andy Larsen of The Salt Lake Tribune reports."
Micah Potter,C,Jan 25,Out,
Monte Morris,PG,Feb 8,Out,
Kyle Kuzma,SF,Feb 8,Out,"Kuzma (ankle) has been ruled out for Wednesday's game against the Hornets, Chase Hughes of NBC Sports Washington reports."
